id,type,status,tiny_link,title,content,is_internal
742064273,page,current,/x/kQA7L,Frequently Bought Together,"Introduction The idea is to display other food items that are recommended for a customer when they are on the check-out page about to place an order. The recommendations will be based on the order history of the PickMe food user base. Ex: When a consumer has added a Chicken Biriyani from Big Bite Restaurant, it is required to check what are the other dishes that the consumers have ordered from same restaurant together with Chicken Biriyani . Based on this, in the check-out page it is required to show the recommendations with an option to add them to the cart from a single tap. This will help customers to find what they need improving their user experience as well as boost revenue by increasing average order value. Since PickMe food does not yet support placing orders from multiple stores at once we will only consider the association of food items within the restaurant. One of the suggested results. Initial analysis based of Apriori. Two approaches were considered for the recommendation algorithm: Apriori FP Growth Parameter selection and performance of the two algorithms were analysed based on the number of rules generated, coverage of the menu and accuracy of predictions. The detailed report summarizing the outcomes can be found here. There is a major limitation for the results due to inconsistency in item id. Based on this Frequent Pattern Growth model was selected for FBT prediction. Initial code deployed has a static min_support defined. However, due to the skewed distribution involving the transaction count with the introduction of marketplace this needed to be a dynamic support based on each merchants performance. Therefore, the second iteration of the modeling includes a dynamic support calculation which will take into account the number of transactions for a given merchant within the data collection period (in this case a 30 day period) . Dynamic Support Calculations will be based on the median frequency in the item set. Pre filters: Number of transactions should be above 30. Maximum basket size would be less than 50. Update on - July 2nd 2020 It can be noticed that dynamic support as Q1 provides the best coverage. Hence the dynamic support was computed using the Q1/number of transaction.",False
742162538,page,current,/x/aoA8L,Popular Restaurant - phase 1,"The sample data set used for analysis consist of the all completed orders in September,2019. There were total of 405 distinct restaurants in selected data set. Criteria for popularity – (phase 1) Restaurant has completed above average number of orders on 20 days out of 30-day rolling window. The cut off value for popular restaurants will be the average sales across all restaurants that falls under above list. Any restaurant that have completed orders above this average will be labeled as popular. The orders of all restaurants will be filtered for outliers and be replaced with the upper fence value in order to remove highly skewness of the restaurant sales distribution, before computing the average sales. Since phase 1 only includes volume of sales, following phased can include aspects such as diversity and rate to improve the model for popularity. As an immediate next step would be to consider a Bayesian approach for sales volume can be used to compute a weighted average for sales.",False
742228058,page,current,/x/WoA9L,Recommendations,"In e-commerce and other digital domains, companies frequently want to offer personalised product recommendations to users. Automatically recommending a product to a customer has become a fundamental part of many successful digital companies. They collect data on their customers’ preferences and use various machine learning approaches to match up customers with the product that they are most likely to enjoy. “Wow,” you think. “They’ve done a pretty good job!” In a situation where companies have more data – however limited it may be – on their customers, products and customer interaction, they can consider using some of the classic recommender systems: Collaborative filtering works by recommending things that similar customers liked. However, it suffers from the cold-start problem, which is when there are new products that no one has used or liked. Content based filtering matches up content or products based on their attributes to a customer’s preferences. This is hard when you don’t yet know a lot about the customer, or you don’t understand what features of a product are pertinent. To avoid this we have discussed a hybrid approach of getting the best of the two worlds. This does not address all the edge cases where you can get rid of all cold start issues, however we have been able to curb this situation to a certain extent. Following are the documentation completed for each time of recommendations. Enjoy the read! Popular Restaurant - phase 1 https://pickme.atlassian.net/wiki/spaces/BDDS/pages/742064273/Ferequently+Bought+Together ""Recommended for you"" personalized recommendations LightFM vs ALS testing",False
742293592,page,current,/x/WIA_L,Discovery Catalog,"The discovery catalog is being divided to two segments as PickMe - Haling and PickMe - Food PickMe - Hailing Identification of shareable rides Shuttle utilization simulation results for selected route https://pickme.atlassian.net/wiki/spaces/BDDS/pages/743112705/Customer+Value+Matrix Driver Fraud Detection Algorithm Trip fare prediction model Pre - booked trip fulfilment analysis Pre-booking risk predictor model building and summary Travel Time Prediction Model Model retraining V2.0.0 Model retraining V2.1.0 Driver churn prediction driver profiling - initial analysis CRM data analysis and feature building Churn prediction - (model building) Taxi Driver Pooling PickMe - Food Recommendations Popular Restaurant - phase 1 https://pickme.atlassian.net/wiki/spaces/BDDS/pages/742064273/Ferequently+Bought+Together ""Recommended for you"" personalized recommendations LightFM vs ALS testing Food order pooling potential Dynamic Delivery Radius Discovery Vendor density analysis Promotion framework related work Miscellaneous Miscellaneous Subscription price modeling v2 Subscription pricing model v1",False
742293632,page,current,/x/gIA_L,Shuttle utilization simulation results for selected route,"Summary The simulation looked at historical data from March 2019 to identify the feasibility of operating a shuttle along Galle Road between Moratuwa and WTC. The route was selected based on the previous analysis done to identify the feasibility of ride sharing. The journey from Moratuwa to WTC is 16.5km and the return journey is 20.5km in travel distance. Based on an average distance of 285m, shuttle stop locations were identified for both journeys. Stops which were at least 250m apart were used to establish pick-up/drop-off points in order to increase the dataset for the simulation, since the current pick-up and drop-off locations are unique based on the passenger's location and preference. The passengers who had pick-up/drop-off locations within the Pick-Up and Drop off Radii 1 were all considered as potential rides for a shuttle. Prior to this analysis, the data was cleaned to exclude certain existing rides which did not meet a specific criterion, these criteria are further explained under Data Preprocessing. In this simulation 56 shuttles were sent at 15-minute intervals from both Moratuwa and WTC from 6am to 8pm. Google API was used to compute the time taken to get from one shuttle stop to the next. This provided the ability to include the estimated time to travel between stops factoring the traffic condition depending on the hour and day of the week. The detailed summary can be found under subtitle Shuttle Schedule. The following table summarizes the study where the maximum and average utilization hours are shown for both journeys. The maximum value indicates average maximum across the weekdays. The average number of rides for Wednesday is penalized slightly due to a Poya day falling on 20 th or March. There are a few caveats that we need to consider when reading the above summary. For example, since the pick-up and drop-off locations are spread within a range from 174m to 628m Further details under subtitle Pick-Up and Drop-Off Radii in this simulation the assumption is that the passengers will need to arrive at the pick-up location which is an inconvenience. On a given weekday the average number of passengers travelling in each of the shuttles is shown in the figures below. For clear view refer the document attached. Key Takeaways Moratuwa to WTC Indicates a maximum of 10 and an average of 3-5 riders using the shuttle between 7-9 am. Out of the total 165.5 passenger kilometers (passengers 10 x 16.5 km) the usage ranges between 80 to 100 passenger kilometers on average for the shuttles which travel from 7 – 9 am. The usage is then close to 50% for the shuttle being used at peak hours. The general tendency indicates that the shuttle reaches close to full capacity around Mount Lavinia – Kollupitiya stretch. WTC to Moratuwa Indicates a maximum of 10 and an average of 4-6 riders using the shuttle from 12 noon till 7pm. Indicates a maximum of 10 and an average of 5 riders using the shuttle between 7-9 am. Out of the total 205.4 passenger kilometers (passengers 10 * 20.5 km) the usage ranges between 100 to 130 passenger kilometers on average for shuttles after 12 noon. This is slightly above 55% of the shuttle being used at the peak hours. Unlike in Moratuwa to WTC stretch where the shuttle reaches full capacity during mid-way of the journey (Mount Lavinia - Kollupitiya), in this direction the shuttle capacity reaches a peak at the start of the journey _GoBack around Hyde Pack/ Slave Island and continues till mid-way towards Bambalapitiya/Wellawatta area. The utilization gradually reduces towards Moratuwa. The utilisation reduces significantly if we consider level 10 H3 cells or 500m apart stops. With the preprocessing step close to 30% of the rides were removed from the original historical dataset to incorporate a level interpretability. The analysis was done only based on the rides taken on PickMe platform. There will be a tendency for new users to use PickMe shuttles in the event they are introduced given they provide a better level of rider experience. Link to the detailed report.",False
743112705,page,current,/x/AQBLL,Customer Value Metrics,"Introduction The purpose of this report is to convey the findings of the RFM (Recency, Frequency, Monetary) analysis completed for the month of July 2019. Understanding customer segments based on parameters such as, current RFM value of customer, demographics, purchasing patterns and future customer value will provide the ability for the business to initiate more targeted campaigns which will aim at simulating each customer segment with the right kind of stimulus. The initial analysis as per the operation teams request will be to identify the customer segments based on their Recency, Frequency and Monetary (RFM) value. Recency: How recently did the customer purchase? i.e. Duration since last purchase (this could be interpreted as the last visit day or the last login time to the PickMe app, but for the purpose of this analysis recency was considered to be the last day the passenger hailed and completed a ride) Frequency: Number of completed rides within July 2019. Monetary: The total fare of all the trips completed within July 2019. Several approaches can be used to segment the data. Segmentation based on business input. Segmentation based on ML clustering, using K-means algorithm Segmentation using the RFM_score as a basis. Out of the proposed methods, I have empirically proven instead of the 27 segments used in approach one, we are able to use a much succinct segmentation of 4 clusters based on approach 2 and 3. This is further described in the Results section of this document. The main advantage of this process is to be able to adopt different marketing strategies for different customer segments. Moreover, clustering customers into different groups improves the quality of the recommendation and helps decision makers identify market segments more clearly and therefore develop more effective strategies. The document contains: Data gathering and pre-preprocessing Approach 1 – Segmentation based on business input Approach 2 – Segmentation based on K-means algorithm Approach 3 – Segmentation using the RFM_score as a basis Detailed document with results is here. Key- Takeaways Approach 2 and 3 provides a more granular segmentation of four, compared to the method given by the business that results in 27 segments. These segments are more directly actionable compared to the 27 segments. However, the combination of these segmentation can be used hand in hand to understand passenger behaviors in detail. The distribution of passengers in approach 1 results in an uneven distribution of passengers across the 27 segments with some having less than 50 passengers. Therefore, it will become difficult to use these segments to create value for passengers in an effective manner. Approach 2 and 3 both provide four segments and the categorization of customers is loosely similar. The RFM score-based approach provides a lower number of customers in the best segments (gold & silver) where monetary and frequency values are high compared to the K-means method where the passenger count is almost double. K-means segmentation provides a more even distribution of passengers across the segments compared to the RFM_score-based approach. K-means clustering method’s lower segment has approximately 100,000 passengers with an average monetary value of approximately Rs. 400 compared to the 120,000 passengers with an average monetary value of approximately Rs. 600 in the RFM_score-based method. Sample results: It can be noticed that customers with RFM_score nine are distinctly on a higher level in monetary value than the rest. Next planned: Stage 2: Using RFM values to perform a churn analysis/customer lifetime value (CLV) and profit potential. This could be modeled via a regression or boosting/ensemble model. The analysis can include features listed below other than the RFM values. Total time spend on the product (AON) Distance of average trip Number of times a trip is made on a given day Number of app opens Number of promotions set, contact points Click stream tracking – if available Prior promotion responses Customer loyalty points Demographics Stage 3: Build on the above model with further feature engineering. We will be able to use Collaborative filtering and hidden neural network layers as our new features. Build a user/item interaction matrix for prediction. Here the item, could be a promotion. Building an activity map based on the POI's. A probabilistic model of MCM (Markov Chain Model) can be used to in that they explicitly account for the uncertainty of the customers future behavior. In the sense, this can address customer retention and customer migration. Retention is we assume that once a customer is lost, PickMe relationship with the customer terminated. Whereas migration refers to non-response not necessarily means permanent loss.",False
764706849,page,current,/x/IYCULQ,Identification of shareable rides,"This was the initial analysis carried out to identify how many shareable rides were taking place on the PickMe platform. The report includes shareable ride counts and locations based on March 2019 completed rides. Limitations Summary Shareable ride component Ride breakdown for each day of the week by the date Shareable ride distribution by the number of shares Hourly break down of shared rides for each day of the week Hourly spread of shared rides as a percentage of the rides for the day Based on this analysis we were able to determine that one of the most dense regions for shared rides on PickMe is the Moratuwa to WTC stretch. Following this a simulation was done to understand the utilization of a shuttle which runs on this particular route. Detailed report for the shareable ride analysis. Sample results as follows: Hourly breakdown of shared rides for each day of the week Monday - Over four Mondays in March there is close to 1,900 rides which indicated that they can be shared. There is a peak in shared ride count in the morning hours from 8am – 9am and in the evening around 5pm. The number of shared rides during peak hours vary roughly between 300 – 700 rides. Pick up heat is concentrated around Fort and Mount-Lavinia areas.",False
764707094,page,current,/x/FoGULQ,Taxi Driver Pooling,"The driver pooling model proposed by Vindula required weight assignment for each of its parameters. The ILP solver provides the optimal driver assignment to each trip by its formulation of the optimization function. The scaling of decision variables are required as we need to provide a weight to incorporate business requirements. We propose below weights which can be used by the core team to multiply each decision variable. Considering business requirement: Directional hire will be assigned a higher priority. This will be given twice the priority over the ETA. Rating will be assigned a smaller weight. This will give more prominence to the ETA as opposed to a marginal difference in Rating. Opportunity cost of a trip will be assigned the same weight as the ETA, since the OC is decided dependent on the ETA and is fixed across all trips. Report submitted by Vindula The scaling and suggested weights can be found in:",False
764772411,page,current,/x/O4CVLQ,Driver Fraud Detection Algorithm,"Drivers resort to various hacks to misuse these incentive schemes. For instance, the higher the number of rides, the more money a driver makes. Therefore, we tried to flag out such drivers who indicate unusual behavior with selected passenger accounts compared to rest of the driver population. The focus of this analysis will be to understand the association between a driver passenger pair by analyzing the number of total completed trips between them over three months. We will hence forth call a completed ride between a driver and a passenger a transaction. The initial analysis and report considering various outlier detection models can be found here. Summary of the algorithm: The effectiveness of the finalized algorithm is documented here using the incentive run from 14th October to 18th October. Reconciliation between the manual driver fraud tagging vs the algorithm can be found here, with a step by step explanation of how a driver-passenger pair is tagged as fraudulent.",False
764969074,page,current,/x/coCYLQ,Trip fare prediction model,"Multiple Linear Regression Applicability of multiple linear regression was considered to predict the trip fare of a completed trip on PickMe platform. Data exploration and results based on multiple linear regression can be found here. Multiple regression models were concidered: Segment 1 - For all taxi models Fare ~ distance + Taxi Model + duration + day of week + pick hour + pick hex Fare ~ distance + Taxi Model + waiting cost + day of week + pick hour + pick hex Fare ~ distance + Taxi Model + duration + day of week + pick hour Fare ~ distance + Taxi Model + waiting cost + day of week + pick hour Log (Fare) ~ distance + Taxi Model + duration + day of week + pick hour + pick hex Log (Fare) ~ distance + Taxi Model + waiting cost + day of week + pick hour + pick hex Log (Fare) ~ distance + Taxi Model + duration + day of week + pick hour Log (Fare) ~ distance + Taxi Model + waiting cost + day of week + pick hour Segment 2 - For Tuk, on Fridays with 5pm pickup hour (models were tested for a restricted data set) Fare ~ distance + duration + day of week + waiting cost Fare ~ distance + waiting cost + speed Fare ~ distance + waiting cost + I (distance *2) Log (Fare) ~ distance + waiting cost Log (Fare) ~ distance + waiting cost + I (distance *2) np.log(fare) ~ distance + waiting cost + speed Moving to Random Forest model These models that were used to predict the taxi fare based on one month historical data did not adhere to the assumptions of linear regression and produced poor results. The next document will discuss linear regression models used for fare prediction and their shortcomings and outline a new approach for prediction based on Random Forest. The regression model before will be used as a base model.",False
805797968,page,current,/x/UIAHM,Runbooks,,False
805797975,page,current,/x/V4AHM,Spark Cluster Batch Workflows,Flow Name Runbook Link previuously_ordered_restaurants https://docs.google.com/document/d/1IHZSpJb6LOTuegUZqLZtMocYpGWgOrz43GmN7vb_mcE/edit?usp=sharing spark_h3 https://docs.google.com/document/d/1jki4rFoU1YgLg1N5pq1zBSlyOeoLBtoV3jZ7v4FJAeU/edit?usp=sharing spark_json https://docs.google.com/document/d/1BGDpRPphRleoHzPWfpuqxfPAASzXt9UOxf-8lNUh_4k/edit?usp=sharing cust_loyalty_points_calculator https://docs.google.com/document/d/1WQ6fwyjoR_ev3ai7H4a50hVuFLJgWvDu26GFz_Tqmvo/edit?usp=sharing cust_loyalty_state_processor https://docs.google.com/document/d/1W7XQuzlLm6IYInYVkmT5--EeHT4JG9RfE-liqSWbFPQ/edit?usp=sharing loyalty_eligibility https://docs.google.com/document/d/1BnFZLIGC4KUCqWF0WFG3n1SSmQJkQBu4pIor86MSYsw/edit?usp=sharing cust_loyalty_event_publisher https://docs.google.com/document/d/1l1M5KRU8Bh7xVLf-fc9qYElwOGs_4YjNbRHrtKvzmEY/edit?usp=sharing trip_flow_restaurants https://docs.google.com/document/d/1-uSQzpffq7TJywtO0tTIFmbYr1qKgrgbwhuXTqPSwd0/edit?usp=sharing SupplyDemand https://docs.google.com/document/d/1M4gKrRngaGWaBkjbgfnvGitCblOG0OeKqgcY58cWUVo/edit?usp=sharing spark_nrt_driver_utilization https://docs.google.com/document/d/1HUeM8b7TfFttPJKwfBh2LCG2qyZ8MJC0Z_1DMhu-QzQ/edit?usp=sharing DailyNoDriverFound https://docs.google.com/document/d/1pQWn1TpHEWuim7rEUG7KIW9xMAZlf_NyX1ScX1Q_KdE/edit?usp=sharing DailyRegionBasedDemand https://docs.google.com/document/d/1iLYczYEYSBOazkdsQVXUDuiR5wKzLkEIVw-Xbj-dei4/edit?usp=sharing DailyRegionBasedExcessSupply https://docs.google.com/document/d/1GUD5Q663tDwIJNeqIxwDPxrTsA5PTtCgNu74cHP38lc/edit?usp=sharing DailyRegionBasedSupply https://docs.google.com/document/d/1C-neMLpSiy2RtBfOEWwtJ-V09_-AGvdkKvsuepA4r58/edit?usp=sharing DailyRegionBasedTripComplete https://docs.google.com/document/d/18N_3II234Sm933J7JEpLfG4xna2oui-5OwW1lbFHDC0/edit?usp=sharing spark_driver_utilization_daily_country https://docs.google.com/document/d/1Ql8JFrZKOgOEOqQWGuiKMg-tC8HHpBGBR4wwZXmOvq4/edit?usp=sharing spark_driver_utilization_daily_hourly https://docs.google.com/document/d/1XXDo3t9rWN2yqu1hqhLU16ZQ7p-JR5nxmAilkXVo2AM/edit?usp=sharing spark_driver_utilization_daily_dsd https://docs.google.com/document/d/131Q4rKHRVvx-gRU8XcAT1QB2sUeTFAJt9eCbtWX2Pm4/edit?usp=sharing fact_hex https://docs.google.com/document/d/1d4jnBgfENjNoJ_jw4qJ1N_UDiZiMSttbfzrQl-9bYAw/edit?usp=sharing driver_incentives_fraud_tagger https://docs.google.com/document/d/1WMRdH9s-B0ehGXEI-L3nBbUhR7uSl9BPHa2ITe_WBWk/edit?usp=sharing driver_incentives_qualifier https://docs.google.com/document/d/1vIl0pjrqCnZB39TdlvBl-Q1yDZx2V984OK7eNEJpyOs/edit?usp=sharing driver_incentives_daily_calculator https://docs.google.com/document/d/1Rg-DqqnhFHXZX7967ZWNQG_zAxpwX9SzC7iQtf-EVQg/edit?usp=sharing service_level_parameter https://docs.google.com/document/d/1a7IKd5SlvTo4Ay1kSgH0HO2t6ko3BCZRqV1MINJL2Hc/edit?usp=sharing Driver-ranking https://docs.google.com/document/d/10TRKklVUrhco5BfBB_8fnqCjU_BXAkLVEHfsFmRSceE/edit?usp=sharing Driver-rating https://docs.google.com/document/d/1sgmA2fZLsky3VYUqUzJfW3sjd0vBTsfYVSzlcks01-8/edit?usp=sharing spark_dsd_visibility https://docs.google.com/document/d/1Fnu1j88YuillD4PaNrbqDloiHYRqq7pUOP8XxYFuMS4/edit?usp=sharing,False
805797992,page,current,/x/aIAHM,HBase Cluster Batch Workflows,Flow Name Runbook Link workflow_foodCustomerRecsRestuarants https://docs.google.com/document/d/1ypB9mLYJSebJtbGJo6zB3uFhNxLFCa3xcRLM5edwZV8/edit?usp=sharing workflow_restaurantMDM https://docs.google.com/document/d/1LxgvoCXESamwMXY04oGXc7R_Oxu2mmrQB3brxCdoaPI/edit?usp=sharing driver_utilization_last_seven_days https://docs.google.com/document/d/1c_0VbZzvnY51KZpVSvZ9oDZoyTre04xQmE39D5nCti0/edit?usp=sharing nrt_driver_utilization https://docs.google.com/document/d/1aAfYq0Tq0Wt2bf5kynPgfMhdGbYS12R7uXkQsvROz_4/edit?usp=sharing,False
