id,type,status,tiny_link,title,content,is_internal
2063204484,page,current,/x/hAD6eg,Model retraining V2.1.0,"Accept to arrive Basic filtration All trips completed between 1st Jan 2021 and 31st March 2021 were filtered based on following basic logics. Removed the trips which have waiting time greater than or equal to actual travel time ( TimeRatio >= 1) Removed the trips which have actual travel time less than 0 (Due to start time and end time recording errors) Removed the trips which have average speed over 100 km/h Removed the trips which have actual distance over 20 km Removed the trips which are not happened with 1,2,3 or 4 taxi models Distribution of continuous features Actual Distance 2. Average Speed 3. Distance Ratio 4. Time Ratio Distribution of discrete features After the analysis, remove the outlier based on following features. AverageSpeed (LF: 3.215 km/h, UF: 33.508 km/h) TimeRatio (LF: 0, UF: 0.87) DistanceRatio (LF: 0.56, UF: 1.34) ActualDistance (LF: 0.001 km, UF: 3.844 km) Start to end Basic filtration All trips completed between 1st Jan 2021 and 31st March 2021 were filtered based on following logics. Removed the trips which have waiting time greater than or equal to actual travel time ( TimeRatio >= 1) Removed the trips which have actual travel time less than 0 (Due to start time and end time recording errors) Removed the trips which have average speed over 100 km/h Removed the trips which have actual distance over 200 km Removed the trips which are not happened with 1,2,3 or 4 taxi models Distribution of continuous features Actual Distance 2. Average Speed 3. Time Ratio 4. Distance Ratio Distribution of discrete features After the analysis, remove the outlier based on following features. AverageSpeed (LF: 10.173 km/h, UF: 37.233 km/h) TimeRatio (LF: 0, UF: 0.52) DistanceRatio (LF: 0.75, UF: 1.2) ActualDistance (LF: 0.001 km, UF: 21.6 km) Features considered for modeling DayOfWeek DayOfWeekSin DayOfWeekCos HourBin HourBinSin HourBinCos StartHexCenterLatitude StartHexCenterLongitude EndHexCenterLatitude EndHexCenterLongitude OSRMDistance Final Model Evaluation To measure the accuracy of the predicted travel time, MAE (Mean absolute error) and RMSE (Root mean square error) was used. MAE measures the average magnitude of the errors in a set of predictions without considering their direction. This takes the average over the test sample of the absolute difference between prediction and actual observation where all individual differences have equal weight. RMSE on the other hand is a quadratic scoring rule that also measures the average magnitude of the error. It’s the square root of the average of squared differences between prediction and actual observation. Hence it gives more weight to larger errors than smaller ones. Latest trained model (V2.1.0) evaluation metrics are mentioned below. Model Feature combinations Estimator Accept to arrive Start to end Train (s) Test (s) Train (s) Test (s) XGBoost Treat as cyclical features. DayOfWeek DayOfWeekSin DayOfWeekCos HourBin HourBinSin HourBinCos Treat as numerical features. StartHexCenterLatitude StartHexCenterLongitude EndHexCenterLatitude EndHexCenterLongitude OSRMDistance Size of the dataset 3,153,044 788,261 3,021,213 755,304 RMSE 164.008 166.807 327.684 338.848 MAE 112.262 113.924 215.862 220.773 Average (ActualTravelTime) 375.325 375.392 1234.158 1233.765 Average (PredictedTravelTime) 375.321 375.390 1234.153 1233.110 Median (ActualTravelTime) 331.0 330.0 1027.0 1026.0 Median (PredictedTravelTime) 356.044 356.069 1051.906 1049.701 Standard deviation (ActualTravelTime) 232.243 231.567 810.621 811.828 Standard deviation (PredictedTravelTime) 158.624 158.400 736.104 736.004 Bench-marking For the bench-marking, we used a validation set of data of the time period between 1st of April 2021 and 30th of April 2021 and compared with the trained model predictions with OSRM estimations and OLD model (model V2.0.0 ) predictions Performance comparison using validation set (1,538,613) is mentioned below. Model RMSE (s) MAE (s) Accept to arrive Start to end Accept to arrive Start to end Latest Model (V2.1.0) 190.288 362.909 126.350 237.073 Previous Model (V2.0.0) 209.800 386.532 147.132 253.157 OSRM 338.635 825.027 264.028 630.913 According to above results we can see the about 9% improvement of the accept-to-arrive model and 6% improvement of the start-to-end model with respect to the previous model (V2.0.0) . Accept to arrive model Mean Absolute Error variation along with distances Root mean square Error variation along with distances Start to end model Mean Absolute Error variation along with distances Root mean square Error variation along with distances",False
2080440398,page,current,/x/TgABf,Incentives Generalization,"Overview Objective of this implementation is to build a generic framework for calculating incentives and analyzing performance of the incentives. Incentives are expected to boost the supply by encouraging drivers and riders to complete more trips/deliveries. Scope Currently flash, food and hailing incentives have been launched and following are the expected outcomes of the full implementation. Support weekend and daily incentives through the incentives engine. Provide an API to configure incentives (prioritized for one day incentives) Move entire incentive calculation to the incentives engine (currently hailing and food are standalone jobs) At a conceptual level, following are the key changes into the current functionality Introduction of the concept of incentive category - daily/weekly/oneday Effective from and to dates Ability to configure applicable driver cohorts The proposed UI for daily incentive calculation is shown below. Plan of Implementation The table structure to store incentives rules are show below Please see https://app.diagrams.net/#G1HgT3RvnDgYmwSqgyDp8YjVt4ahwI2kAB The main implementation tasks would involve Introducing a new entity incentives which would define the incentive ref - auto generated reference which encapsulate the incentive type, category , dates and a sequence number title - title produced by the UI effectivefrom and effectiveto - effective date range. For one day incentives this would be the same date servicetypes drivercohort - as specified from the UI for oneday incentives. Could be null in which case it would be applicable to all remarks - as specified from the UI daysconsidered - how many days are considered for determining the applicable strategy. This is not applicable for one day incentives so the value may be 0 incentivecategory - weekly, weekend, daily incentivetype - food, hailing etc. Existing incentive_strategies table would remain the same except that the incentivetype is moved out to incentive table. This table is not applicable for one day incentives given that the concept of limit based strategies are not applicable. However to make calculation generalized an entry would be added here where range start would be 0 and rangeend would be a large number. incentive_strategy_target table would remain the same The API development would involve providing CRUD operations on the incentives data. The upload of driver cohorts would be initially through a manual upload Changes to the Data Pipelines Changes to the API External References BRS - BRS - Driver Portal for Oneday Incentives (taxi & food) SRS - [DriverPortal] SRS - One-day Incentives Upload Capability",False
2080441189,page,current,/x/ZQMBf,Ingesting the driver cohort data from the Eztaxi DB,"Overview Objective of this task is to implement data pipelines to ingest yesterday data in dr_cohort, dr_cohort_driver, dr_cohort_types tables. Plan of Implementation Implementing three pipelines to ingest data from each tables dr_cohort, dr_cohort_driver, dr_cohort_types. These tables are in the Eztaxi DB. Schema of the dr_cohort Column Name Data Type Comment id int(11) Auto Increment name varchar(50) service_type int(11) NULL cohort_type int(11) description text NULL created_date datetime NULL modified_date datetime NULL status char(1) NULL [ A ] ‘A’ , ‘D’ Schema of the dr_cohort_types Column Name Data Type Comment id int(11) Auto Increment The id of the cohort type. This is the primary key of the table. name varchar(255) cohort name. type_key varchar(255) cohort key. created_at datetime [ CURRENT_TIMESTAMP ] The created time of the cohort type. updated_at datetime NULL The updated time of the cohort type. status char(1) NULL [ A ] status of the cohort type. Schema of the dr_cohort_driver Column Name Data Type Comment id int(11) Auto Increment int(11) NULL driver_id int(11) NULL created_date datetime NULL modified_date datetime NULL status char(1) NULL [ A ] ‘A’ , ‘D’ Plan for testing Pipelines can be tested by executing the workflows in dev environment and comparing the output.",False
2080473089,page,current,/x/AYABf,2021-05-07 Data Science Initiatives,Date Participants List meeting participants using their @mention names: Goals We try to achieve following objectives Build clarity around data science initiatives Discuss bottlenecks/risks Collectively agree on the deliverable Discussion topics Time Item Presenter Notes 5 min Review Data Science Roadmap Sanjaya Data Science & Engineering Roadmap 5 min Establish an implementation framework for all projects till August release Sanjaya 10 min Review Action items Sanjaya Action items Add action items to close the loop on open questions or discussion topics: 33 complete Re-validate the priorities in the DSE roadmap 41 complete Prioritize Search in the Roadmap 34 incomplete Review June commitments and understand requirements for experiments Decisions Type /decision to record the decisions you make in this meeting: e968e7cc-0a12-44f3-8fdc-165573f70769 DECIDED f3f42d19-b3dc-4140-bff0-3b43d389147e,False
2080899252,page,current,/x/tAAIf,Customer Loyalty State Processor Flow,"Overview The purpose of this document is to give an understanding of what the activities of the logic are, and the flow of it that defines the customer loyalty state processor; which is the job that is responsible for the customer loyalty related logic from the data services perspective. Customer loyalty state processor is a daily job that updates the customer’s loyalty state at the end of each day by accumulating that day’s trip points to the current points and does any required tier promotions or expiries. It also creates event bodies based on the passenger loyalty Kafka topic and stores them in the HIVE, which will be later fetched by a Kafka producer and published to the topic. Activity Flow The customer loyalty state processor has the following high level activities (which applies to each customer) in the order shown below. Fetch metadata related to tiers Tier name Tier cost Target tier name Duration for tier Fetch customer’s current loyalty state Current tier Current points Target tier Highest secured tier Expiry date Fetch today’s customer accumulated trip points (Excluding anomalies) Add today’s accumulated trip points to current points ( Current points ← Current points + today’s points ) Based on the new current points or the expiry date, update the customer’s tier accordingly Tier promotions (User has reached points threshold for target tier) Update user’s current tier to the user’s target tier ( Current tier ← Target tier ) Subtract the target tier cost (taken from tier metadata) from the current points ( Current points ← Current points - Target tier cost ) Update user’s target tier to be the target tier of the new current tier based on the tier metadata. Update Highest secured tier to lowest BLUE tier. Set expiry date to the new current tier’s tier duration taken from tier metadata ( Expiry date ← today + current tier duration ) Create tier_renewal event and save in event_log Tier expiry (User has not reached target tier and expiry date is reached) Update user’s current tier to user’s highest secured tier ( Current tier ← Highest secured tier ) Subtract the highest secured tier cost (taken from tier metadata) from the current points ( Current points ← Current points - Highest secured tier cost ) Update user’s target tier to be the target tier of the new current tier based on the tier metadata. Update Highest secured tier to lowest BLUE tier. Set expiry date to the new current tier’s tier duration taken from tier metadata ( Expiry date ← today + current tier duration ) Create tier_renewal event and save in event_log Based on current points, update the highest secured tier fields of customers Update customer’s Highest secured tier to the tier corresponding to the largest tier cost (taken from tier metadata) that is still less than the current points Create tier_secured event and save in event_log Evaluate other thresholds scenarios that have been reached based on the current points About to Jump (User has secured his current tier and has obtained at least 95% of the target tier cost in their current points) Create threshold_reached event of type ABOUT_TO_JUMP and save in event_log About to Fall (User has not secured his current tier but has achieved at least 95% of the current tier cost in their current points and there is only 14 days left to tier expiry) Create threshold_reached event of type ABOUT_TO_FALL and save in event_log Save customer’s final state to HIVE after processing and log final state in Kafka Create daily_snapshot event and save in event_log",False
2092827387,page,current,/x/_wK_f,Analysis of Real-time Data Pipelines,Current Architecture Raw Ingestion Details Raw Ingestion Use Case Details Use Cases,False
2101313863,page,current,/x/R4E-fQ,Vtiger PassengerDetail Technical Specification,"Overview The purpose of this document is to detail the requirements of the Vtiger.PassengerDetailUpload and the implementation changes to the existing Vtiger.PassengerDetail export job. Requirements Consider only app accounts excluding roadside hires for trip metrics If there is only active mobile accounts for a phone number the latest created one have to be selected If all the accounts for the a phone number is deactivated, latest created account have to be selected If a phone number has active and deactivate accounts the latest active one have to be select If a phone number has both app and cooperate account and the cooperate account is active cooperate data have to be join with app account CompanyName and DepartmentName should be combined from cooperate using mobile number UpdatedDateTime - the most recent updated date from either app or cooperate (Requirement already satisfied) CreatedDateTime - value for app account (Requirement already satisfied) Plan of implementation This section will detail the implementation changes to accommodate the above requirements. The implementation changes will be applied to the export query itself (from HIVE to SQL) instead of adjusting the PassengerDetailUpload view. Instead of the current Left join of dim_passenger with other tables, run the following filters and windowing in the order given below. This may require subqueries. Filter in the passenger accounts corresponding to normal app hires (createdby = 1) and cooperate hires (createdby =6) Filter in only active cooperate accounts (userstatus = 'A') RANK() the table partitioning by phone number, account type and account status (phone, createdby, and userstatus) and ordering by descending created date (createddatesk) Filter records where the above rank is 1 Use a LEAD window function to get cooporate passengerid corresponding to app passenger id as a column (AS co_pid). Partition by phone number (phone) and order by account type (createdby) Use a LEAD window function to get the account type of the leading tuple corresponding to app passenger id as a column (AS lead_createdby). Partition by phone number (phone) and order by account type (createdby) Filter in only the app passenger Ids (createdby = 1) Filter the accounts that are active (userstatus = 'A') OR if that account is inactive, filter in the accounts whose account type is different from the leading account type or leading account type is NULL. Join the above relation with dim_cooperate_passenger (using co_pid and passengerid) Non functional requirements (NFRs) Current Vtiger jobs take some time to finish. This added changes should add minimal execution time. By filtering active accounts before joining with other tables, the reduction of overall execution time is also expected. Reference to delivery artifacts Plan for testing The added changes will be tested using data fetched from the production cluster for the relevant tables. Initial testing will be done using data coming user created tables.",False
2102068133,page,current,/x/pQNLfQ,Weekend Incentives,"Overview Existing implementation of the weekly incentives is outlined below. driver-incentives-qualifier-job This logic is executed by a qualifier job that runs weekly. Logic considered is outlined in the diagram below. driver-incentives-daily-calculator-job Plan of Implementation Weekend Incentives The idea would be to introduce an incentive category (weekly,weekend) to strategy and target tables. The same qualifier jobs would be run with a configuration which indicates whether it is a weekly incentive or weekend. This configuration would drive, Loading of the days scope (weekdays or weekends) for fetching the rides val week_day_keys = ""SELECT datekey, WeekOfYear "" + ""FROM "" + Config.STAGE_DB + "".dim_date "" + ""WHERE `date` < CAST(FROM_UNIXTIME(UNIX_TIMESTAMP("" + ""'"" + Config.CURRENT_DATE_PARTITION + ""' , '"" + Config.DATE_FORMAT + ""')) AS Date) "" + >>>>>>>>>>>>>>>>>>>>>>>>>>>>>>>>>> ""AND isweekday = 1 "" + >>>>>>>>>>>>>>>>>>>>>>>>>>>>>>>>>> ""ORDER BY datekey desc "" + ""LIMIT "" + Config.PAST_DAYS_CONSIDERED Loading the appropriate incentive strategies and targets for the incentive category // Query to get incentive strategies val incentive_strategies = ""SELECT "" + ""StrategyName, "" + ""TaxiModel, "" + ""RangeStart, "" + ""RangeEnd "" + ""FROM "" + Config.STAGE_DB + "".driver_incentive_strategy "" + ""WHERE TaxiModel IN ("" + Config.TAXI_MODELS + "") <<<<<<<<<<<<<<<<< filter for category >>>>>>>>>>>>>>>>>>"" // Query to get incentive targets val incentive_targets = ""SELECT "" + ""StrategyName, "" + ""TaxiModel, "" + ""TargetTrips, "" + ""IncentiveAmount, "" + ""CompletionRatio AS CompletionRatioTarget "" + ""FROM "" + Config.STAGE_DB + "".driver_incentive_strategy_target "" + ""WHERE TaxiModel IN ("" + Config.TAXI_MODELS + "") <<<<<<<<<<<<<<<<< filter for category >>>>>>>>>>>>>>>>>>"" Incentive category would also be written to the final results set val driver_weekly_incentive_new_df = driver_trips_summary .join(driver_fraud_trips_df, driver_trips_summary(""DriverId"") === driver_fraud_trips_df(""FraudDriverId""), ""left"") .na .fill(0) .withColumn(""PastDaysConsidered"", lit(Config.PAST_DAYS_CONSIDERED)) .withColumn(""date_time"", lit(Config.CURRENT_DATE_PARTITION)) .withColumn(""EligibilityPeriod"", lit(Config.INCENTIVE_VALIDITY_PERIOD)) >>>>>>>>>>>>>>>>>>>>>>>>>>>>>>>>>>>> incentive category as a column here >>>>>>>>>>>>>>>>>>>>>>>>>>>>>>>>>>>> .select( col(""DriverId""), col(""TaxiModel""), col(""StrategyName""), col(""QualifyingTrips"").alias(""TotalLegitimateTrips""), col(""FraudTripCount"").alias(""FraudTrips""), col(""ITCTrips""), col(""HFCTrips""), col(""RPPTrips""), col(""MaximumTrips""), col(""PastDaysConsidered""), col(""TargetTrips"").alias(""IncentiveTarget""), col(""IncentiveAmount""), col(""EligibilityPeriod""), col(""CompletionRatioTarget""), col(""date_time"") ) Following changes would be required in the driver-incentives-daily calculator-job Incentive category should be passed as a parameter for the job Loading of driver trips should consider weekends or weekdays depending on the incentive category val driver_trips = ""SELECT "" + ""fr.TripId AS TripId, "" + ""fr.DriverId AS TripDriverId, "" + ""fr.PassengerId AS TripPassengerId, "" + ""fr.TaxiModelId AS TripTaxiModel, "" + ""COALESCE(DropDateSK, CreateDateSK) as DropDateSK, "" + ""fr.tripfare AS TripFare, "" + ""fr.paymentmethod AS PaymentMethod "" + ""FROM "" + Config.STAGE_DB + "".fact_rides fr "" + ""WHERE fr.TaxiModelId IN ("" + Config.TAXI_MODELS + "") AND "" + ""fr.TravelStatus = 1 AND "" + ""COALESCE(CreateDateSK, DropDateSK) > CAST(REGEXP_REPLACE(("" + max_inc_target_date + ""),'-','') AS INT) AND "" + ""COALESCE(CreateDateSK, DropDateSK) <= CAST(REGEXP_REPLACE(('"" + Config.CURRENT_DATE_PARTITION + ""'),'-','') AS INT) "" + ""ORDER BY fr.DriverId"" Loading of driver kpis should consider weekends or weekdays depending on the incentive category val driver_kpi = ""SELECT "" + ""fddk.DriverId AS KPIDriverId, "" + ""dtm.mappingtaximodelid AS KPITaxiModel, "" + ""SUM(fddk.ITCTripCount) AS ITCTripCount, "" + ""SUM(fddk.HireFeeTripCount) AS HireFeeTripCount, "" + ""SUM(fddk.RoadPickupTripCount) AS RoadPickupTripCount "" + ""FROM "" + Config.STAGE_DB + "".fact_daily_driver_kpi fddk "" + ""INNER JOIN ("" + driver_primary_taxi + "") dtm "" + ""ON fddk.DriverId = dtm.mappingdriverid "" + ""WHERE fddk.TaxiModelId IN ("" + Config.TAXI_MODELS + "") AND "" + ""fddk.Datekey >= dtm.mappingcreatedatesk AND "" + ""fddk.DateKey > CAST(REGEXP_REPLACE(("" + max_inc_target_date + ""),'-','') AS INT) AND "" + ""fddk.DateKey <= CAST(REGEXP_REPLACE(('"" + Config.CURRENT_DATE_PARTITION + ""'),'-','') AS INT) "" + ""GROUP BY fddk.DriverId, dtm.mappingtaximodelid "" + ""ORDER BY fddk.DriverId"" Loading of trip_flow should consider weekends or weekdays depending on the incentive category val trip_flow = ""SELECT tf.rejected_driver_id AS RejectedDriverId, "" + ""dtm.mappingtaximodelid AS RejectedTaxiModel, "" + ""tf.rejection_type AS RejectionType, "" + ""COUNT(tf.rejection_type) AS RejectionCount "" + ""FROM "" + Config.STAGE_DB + "".trip_flow tf "" + ""INNER JOIN ("" + driver_primary_taxi + "") dtm "" + ""ON tf.rejected_driver_id = dtm.mappingdriverid "" + ""WHERE tf.vehicle_type IN ("" + Config.TAXI_MODELS + "") "" + ""AND tf.rejection_type IN ('"" + Config.MANUAL_REJECTION_TRIP + ""', '"" + Config.SYSTEM_REJECTION_TRIP + ""') "" + ""AND CAST(REGEXP_REPLACE((tf.created_date),'-','') AS INT) >= dtm.mappingcreatedatesk "" + ""AND CAST(REGEXP_REPLACE((tf.created_date),'-','') AS INT) > CAST(REGEXP_REPLACE((("" + max_inc_target_date + "")),'-','') AS INT) "" + ""AND CAST(REGEXP_REPLACE((tf.created_date),'-','') AS INT) <= CAST(REGEXP_REPLACE(('"" + Config.CURRENT_DATE_PARTITION + ""'),'-','') AS INT) "" + ""GROUP BY tf.rejected_driver_id, dtm.mappingtaximodelid, tf.rejection_type "" Loading of qualifiers should take into consideration the incentive category val driver_incentive_targets = ""SELECT "" + ""driverid AS DriverId, "" + ""taximodel AS TaxiModel, "" + ""phonenumbers AS PhoneNumbers, "" + ""strategyname AS StrategyName, "" + ""incentivetarget AS Target, "" + ""incentiveamount AS Amount, "" + ""CompletionRatioTarget, "" + ""QualifierId "" + ""FROM "" + Config.STAGE_DB + "".driver_incentive_qualifiers "" + ""WHERE date_time IN ("" + max_inc_target_date + "")""",False
2109177869,page,current,/x/DYC3fQ,2021-05-14 Data Science Initiatives,Date Participants List meeting participants using their @mention names: Goals We try to achieve following objectives Build clarity around data science initiatives Discuss bottlenecks/risks Collectively agree on the deliverable Discussion topics Time Item Presenter Notes 5 min Architecture Simplification Sanjaya 10 min Search & the elastic search Sanjaya 5 min Rider Hailing ETA Sanjaya/Pulara 10 min Food Promotions Pulara Action items Add action items to close the loop on open questions or discussion topics: 33 complete Re-validate the priorities in the DSE roadmap 41 complete Prioritize Search in the Roadmap 34 incomplete Review June commitments and understand requirements for experiments Decisions Type /decision to record the decisions you make in this meeting: e968e7cc-0a12-44f3-8fdc-165573f70769 DECIDED f3f42d19-b3dc-4140-bff0-3b43d389147e,False
